{
  "schemaVersion": "0.2",
  "profileVersion": "0.1.0",
  "sourceDigest": "sha256:aaaaaaaaaaaaaaaaaaaaaaaaaaaaaaaaaaaaaaaaaaaaaaaaaaaaaaaaaaaaaaaa",
  "contexts": [
    {
      "context": { "theme": "light" },
      "tokens": [
        {
          "id": "color.primitive.common.white",
          "domain": "color",
          "tier": "primitive",
          "dtcgType": "color",
          "resolvedValue": {
            "colorSpace": "oklch",
            "components": [1, 0, 0],
            "alpha": 1,
            "hex": "#ffffff"
          },
          "source": {
            "file": "file:///tokens/base.tokens.json",
            "pointer": "/color/primitive/common/white"
          },
          "dependencies": []
        },
        {
          "id": "color.semantic.surface.default",
          "domain": "color",
          "tier": "semantic",
          "dtcgType": "color",
          "resolvedValue": {
            "colorSpace": "oklch",
            "components": [1, 0, 0],
            "alpha": 1,
            "hex": "#ffffff"
          },
          "source": {
            "file": "file:///tokens/base.tokens.json",
            "pointer": "/color/semantic/surface/default"
          },
          "dependencies": ["color.primitive.common.white"]
        }
      ]
    },
    {
      "context": { "theme": "dark" },
      "tokens": [
        {
          "id": "color.primitive.common.white",
          "domain": "color",
          "tier": "primitive",
          "dtcgType": "color",
          "resolvedValue": {
            "colorSpace": "oklch",
            "components": [1, 0, 0],
            "alpha": 1,
            "hex": "#ffffff"
          },
          "source": {
            "file": "file:///tokens/base.tokens.json",
            "pointer": "/color/primitive/common/white"
          },
          "dependencies": []
        },
        {
          "id": "color.semantic.surface.default",
          "domain": "color",
          "tier": "semantic",
          "dtcgType": "color",
          "resolvedValue": {
            "colorSpace": "oklch",
            "components": [1, 0, 0],
            "alpha": 1,
            "hex": "#ffffff"
          },
          "source": {
            "file": "file:///tokens/theme-dark.tokens.json",
            "pointer": "/color/semantic/surface/default"
          },
          "dependencies": ["color.primitive.common.white"]
        }
      ]
    }
  ]
}
